{
  "schemaVersion": "1.0.0",
  "receiptId": "PVLR-SYNTHETIC-001",
  "candidate": {
    "candidateId": "synthetic-candidate-001",
    "artifactPath": "candidate.mp4",
    "sha256": "aaaaaaaaaaaaaaaaaaaaaaaaaaaaaaaaaaaaaaaaaaaaaaaaaaaaaaaaaaaaaaaa",
    "bytes": 23,
    "sourceRevision": "synthetic-revision-001",
    "renderProvenanceId": "synthetic-render-001"
  },
  "listener": {
    "role": "audio-captions-sync-reviewer",
    "contextId": "audio-reviewer-listening-001"
  },
  "fullListening": {
    "continuous": true,
    "mediaDurationSeconds": 45,
    "startedAt": "2026-07-29T15:01:00.000Z",
    "completedAt": "2026-07-29T15:02:00.000Z"
  },
  "checks": [
    { "id": "full-program", "passed": true, "notes": "The exact encoded candidate was heard continuously from start to finish." },
    { "id": "pronunciation", "passed": true, "notes": "Names, acronyms, stress, and pronunciation-risk entries were heard and passed." },
    { "id": "delivery-and-pacing", "passed": true, "notes": "Delivery, pauses, pacing, and emphasis were natural and intentional." },
    { "id": "artifacts-and-discontinuities", "passed": true, "notes": "No clipped words, skips, tail leaks, abrupt edits, or discontinuities were heard." }
  ],
  "findings": [],
  "status": "PASS",
  "generatedAt": "2026-07-29T15:02:00.000Z"
}
